{
  "video_id": "yt_destiny_2_beyond_light_gameplay_trailer",
  "youtube_url": "https://www.youtube.com/watch?v=Ms90okhAbTw",
  "title": "Destiny 2: Beyond Light \u2013 Gameplay Trailer",
  "usage_class": "third_party_copyrighted",
  "source_rights_note": "Bungie, Inc. copyrighted footage. Bungie's fan-content policy permits non-commercial fan creations, including fan music videos, using Bungie assets. This index stores only metadata and timestamps, not the footage.",
  "playlist": "Destiny 2 Trailers",
  "era": "beyond_light",
  "content_type": "gameplay",
  "activity": "unknown",
  "provenance": {
    "era": {
      "source": "observed",
      "label_source": "heuristic",
      "confidence": 0.9
    },
    "content_type": {
      "source": "observed",
      "label_source": "heuristic",
      "confidence": 0.85
    },
    "activity": {
      "source": "observed",
      "label_source": "heuristic",
      "confidence": 0.4
    }
  }
}
