{
  "video_id": "yt_excision_cayde_finale",
  "youtube_url": "https://www.youtube.com/watch?v=qL7STl21PYg",
  "title": "You're My Favorite... Don't Ever Forget That | Destiny 2 The Final Shape Final Mission Cutscene",
  "description": "The second of four final cutscenes for The Final Shape, played after the Witness is defeated in the Excision mission.",
  "era": "the_final_shape",
  "activity": "cinematic",
  "content_type": "cutscene",
  "destination": "the_pale_heart",
  "usage_class": "third_party_copyrighted",
  "source_rights_note": "Third-party cutscene capture by Swept of Bungie in-engine footage. The uploader's contribution is limited to the capture. Used under Bungie's fan-content forbearance, which is explicitly not permission, is revocable, and permits non-commercial fan creations only. This repository stores metadata and timestamps, never the footage.",
  "provenance": {
    "era": {
      "source": "observed",
      "label_source": "manual",
      "confidence": 1.0
    },
    "activity": {
      "source": "observed",
      "label_source": "manual",
      "confidence": 1.0
    },
    "content_type": {
      "source": "observed",
      "label_source": "manual",
      "confidence": 1.0
    },
    "destination": {
      "source": "observed",
      "label_source": "manual",
      "confidence": 1.0
    }
  }
}
