{
  "video_id": "yt_destiny_2_the_final_shape_launch_trailer",
  "youtube_url": "https://www.youtube.com/watch?v=6Gm5mbwrqSA",
  "title": "Destiny 2: The Final Shape | Launch Trailer",
  "usage_class": "third_party_copyrighted",
  "source_rights_note": "Bungie, Inc. copyrighted footage. Bungie's fan-content policy permits non-commercial fan creations, including fan music videos, using Bungie assets. This index stores only metadata and timestamps, not the footage.",
  "playlist": "Destiny 2 Trailers",
  "era": "the_final_shape",
  "content_type": "trailer",
  "activity": "cinematic",
  "provenance": {
    "era": {
      "source": "observed",
      "label_source": "heuristic",
      "confidence": 0.9
    },
    "content_type": {
      "source": "observed",
      "label_source": "heuristic",
      "confidence": 0.9
    },
    "activity": {
      "source": "observed",
      "label_source": "heuristic",
      "confidence": 0.8
    }
  }
}
