{
 "video_id": "yt_destiny_2_rally_the_troops_worldwide_reveal_trailer",
 "youtube_url": "https://www.youtube.com/watch?v=ZJLAJVmggt0",
 "title": "Destiny 2 \u2013 \u201cRally the Troops\u201d Worldwide Reveal Trailer",
 "usage_class": "third_party_copyrighted",
 "source_rights_note": "Bungie, Inc. copyrighted footage. Bungie's fan-content policy permits non-commercial fan creations, including fan music videos, using Bungie assets. This index stores only metadata and timestamps, not the footage.",
 "era": "d2_base",
 "content_type": "trailer",
 "activity": "cinematic",
 "provenance": {
  "era": {
   "source": "observed",
   "label_source": "manual",
   "confidence": 0.99
  },
  "content_type": {
   "source": "observed",
   "label_source": "heuristic",
   "confidence": 0.9
  },
  "activity": {
   "source": "observed",
   "label_source": "heuristic",
   "confidence": 0.8
  }
 }
}